The now well-known Declaration of Independence was an explanation of this decision adopted two days later and served to morally and legally legitimize the secession from the British Crown and the War of Independence.	Legitimization
In Weston, Massachusetts, a tavern was vandalized by a mob of citizens dressed as Indians after a rumor spread that the owner was selling East Indian bohea tea.	handled
In addition, it was not possible to overcome the major reservations that had already existed in the 1930s against a joint SPD and KPD policy.	cleared out
Losing the "party document" membership card was considered a serious offense, as it could fall into the hands of the "class enemy", and was punished with at least a reprimand.	punished
In the cultural life of the GDR, which was strongly controlled by the SED, phases of openness alternated several times with phases of rigid paternalism during the four decades of its existence.	Paternalism
With the remark that "in our country, anyone can switch Western media on and off at will", Honecker ended the fight against the reception of West German radio and TV stations in the GDR in 1973, as well as the reservations about long hair, short skirts and blue jeans, the "rivet pants" that had previously been castigated as a symbol of Western decadence.	castigated
The striking changes that were made to the original constitution of the GDR reflect the development and the respective political guidelines of the SED leadership, which held the actual power in the state.	actual
At the beginning of the 1950s, for example, it was still quite possible to publicly discuss the inadequate supply of spare parts for motor vehicles and specifically name the government and its organs as the culprits.	Specifications
However, from the outset, the GDR was unable to keep up with the pace of the economic upswing in West Germany, much to the annoyance of its population.	Exasperation
There was also the application to leave the country, which, however, did not concern travel in the tourist sense, but emigration from the GDR and was also only partially approved and subject to harassment.	approved
You two, who have stood by me so often, In hardship and affliction, Tell me, what do you hope from our venture in German lands?	Enterprise
And quickly and incomprehensibly fast the earth's splendor revolves; Paradise's brightness alternates with deep, shuddering night.	more thrilling
O if you, full of moonlight, would look for the last time on my torment, which I woke up many a midnight at this desk: Then over books and paper, gloomy friend, you would appear to me!	Turbid
A barrel of garbage and a junk room And at the most a main and state action With excellent pragmatic maxims, As they suit the dolls' mouths!	maxims
The few who recognized any of it, Who foolishly enough did not keep their full heart, Revealed their feeling, their vision to the mob, Have been crucified and burned from time immemorial.	rabble
With zeal I have applied myself to my studies; I know much, but I would like to know everything.	diligent
The father shows you to his boy, Everyone asks and urges and hurries, The fiddle stops, the dancer lingers.	stays
Thus you oppose the eternally active, the salutary, creative force with the cold fist of the devil, which clenches treacherously in vain!	treacherous
If it pleases you, I am also prepared to stay here in your company; but on condition that I pass the time worthily for you with my arts.	worthy
Cursed be Mammon, if with treasures He stirs us to bold deeds, If he lays the cushions for us to idle gain!	idle
In contrast to a static definition that focuses primarily on normative aspects, the functional character of democracy can thus be grasped, above all through a negative definition in relation to organized rule.	grasp
In the 18th century, a republic was generally understood to be a community in which the laws ruled, a good regime as an antonym to the increasingly criticized despotism.	Antonym
Salzborn names the following values as inscribed in the modern conceptual genesis of democracy: individual freedom as a subject, the connection between state and popular sovereignty and the guarantee of elementary rights of the people against the state.	more elementary
His doctrine lacked "any protection against the potential despotism of the majority."	Despotism
Only in very small communities with as few generally detrimental luxuries as possible does he consider it possible to safeguard the rights of the people and citizens.	Preservation
Another innovation in democratic theory introduced by the authors of the Federalist Papers was the primacy of the Constitution.	Primacy
On the one hand, this can take place in the informal political process by including social groups in the opinion-forming process of parliament and government through hearings; on the other hand, this can also be formally guaranteed by means of fixed proportionality or parity rules that regulate political participation and the allocation of offices.	Participation
He argues and analyzes in a way that he would readily acknowledge as infantile within the sphere of his real interests.	infantile
Pinker himself calls the phenomenon "de-civilization in the 1960s" because the political and social upheavals in Western countries had considerable aggressive side effects that had not existed in the two decades before, such as a massive increase in murders and terrorism.	massive
On the day of his arrival, when the king, refreshed and calm from his bath, was about to take his robe from his wife's hand, the corrupt woman threw a wrinkled and artificially tangled fabric on his shoulders, around his noble head; and as he strove in vain to develop himself as if from a net, Aegisth, the traitor, struck him, and this great prince went to the dead in disguise.	Main
The assassination of the movement's spokesman Rudi Dutschke on April 11, 1968 marked the beginning of its disintegration, from which the various authoritarian-centralist K-groups and left-wing terrorist groups (June 2 Movement, Red Army Faction) emerged.	emerged
They stood in the tradition of anarchism and surrealism, wanted to promote the autonomy of the individual and undermine the appropriation strategies of modern capitalism through imaginative, satirical and effective provocations.	undermined
General Moczar launched an anti-Semitic campaign against "seditious Zionists" and enabled Gomułka to remove competitors and opponents from the state apparatus on the pretext that they were "Zionists".	Competitors
Mao spoke of the corruption of the local cadres by the rural bourgeoisie.	Bourgeoisie
The people declared class enemies by the Red Guards were fought, beaten, ridiculed and their property confiscated.	confiscated
The constantly repeated slogan "Love for mother and father is not like love for Mao Zedong" prompted countless Red Guards to denounce their parents as "counter-revolutionaries" - just as the Cultural Revolution was a heyday of denunciation in general.	denounce
The party's provincial committees were to be reinstalled and the great mass of disparaged cadres rehabilitated and reinstated.	rehabilitated
In China, however, Mao saw a solidification of the status quo with a bureaucratic class that cemented its position, detached from the masses.	cemented
With the ostensible aim of removing capitalist, bourgeois and traditionalist infiltrations of society by continuing the class struggle, the movement was accompanied by massive human rights violations and political assassinations up to the highest level; among others, Mao's disgraced designated successors Liu Shaoqi and Lin Biao died.	designated
After various plans had already been discussed during the war, but later rejected, as to what to do with the Germany responsible for the world war, the Western Allies finally decided in favor of reconstruction.	finally
At the end of the 1940s, a dynamic economic upturn began in West Germany, which lasted until the oil price crisis in 1973, interrupted only by a dip in the economy in 1966 and 1967.	stopped
With its relatively generous regulation of old debts for Germany, which were almost halved, it became an important basis for further advancement.	Ascent
It was also the year in which the Federal Republic largely regained its sovereignty - on May 5, 1955, exactly 10 years to the day after the partial surrender of the German Wehrmacht to the Western Allies.	largely
US economic aid through the Marshall Plan facilitated the reconstruction of Western Europe and thus also the economic miracle in Germany, possibly accelerating it somewhat at times, but it was by no means the sole cause.	by no means
According to Say's theorem, supply-side theorists assume that companies that are losing out to competitors will look for and find profitable investment opportunities elsewhere.	profitable
Werner Abelshauser and Mark Spoerer, for example, have objected to this view, arguing that it postulates a special West German development that does not correspond to the facts.	Facts
This suggests that the various economic policy concepts are of little practical significance as long as property rights and a minimum level of competition are guaranteed.	Concepts
Based on the specifically German interpretation of the post-war boom, Chancellor Helmut Kohl, most German politicians and most West German economists believed in 1990 that a second economic miracle could be ignited in the 5 new federal states simply by unleashing market forces induced by regulatory policy.	ignite
According to an econometric analysis by Ludger Lindlar, the catch-up thesis for the period from 1950 to 1973 offers a conclusive and empirically well-supported explanation for the rapid productivity growth in Western Europe and Japan.	rapid
"... to maintain international peace and security and to this end to take effective collective action to prevent and remove threats to the peace, to suppress acts of aggression and other breaches of the peace, and to settle or adjust by peaceful means, in accordance with the principles of justice and international law, international disputes or situations which may lead to a breach of the peace.	true
"... to maintain international peace and security and to this end to take effective collective action to prevent and remove threats to the peace, to suppress acts of aggression and other breaches of the peace, and to settle or adjust by peaceful means, in accordance with the principles of justice and international law, international disputes or situations which may lead to a breach of the peace."	prevent
It can therefore claim almost universal validity.	Validity
In the past, the five permanent members of the Security Council have made extensive use of their right of veto to avert condemnations and sanctions against themselves or friendly states.	Sanctions
Although the delegates from democratic states can be regarded as indirectly elected by the people, the representatives of dictatorial and authoritarian states in the UN have just as little democratic legitimacy as the governments of these states.	legitimized
Rather, it is a negotiating forum for diplomats from all over the world and a trendsetter in the negotiation of international treaties and the discussion of global political events.	Done
The United Nations succeeded in uniting almost all states of the world under one roof primarily because the Charter can be interpreted so flexibly at key points that it can be interpreted by practically all cultural convictions and political ideologies - even if these are sometimes mutually exclusive - in their sense and in their favor according to the situation.	In favor of
Mao was furious about the cadres who had no idea about grassroots work and only adhered to dogmas from the books.	append
In 1950, the Communist Party passed a marriage law that supplemented the constitution by establishing equality between men and women.	concretized
Although the undesirable side effects of the economic reforms were controversially discussed within the party leadership, the Deng era was a period of comparatively great unanimity.	Unanimity
Before the economic reforms began in 1978, China's service sector was characterized by state-owned enterprises, rationing and regulated prices - with the reform came private markets, individual entrepreneurs and a commercial sector.	Sector
Other constitutive features mentioned are: accumulation (for some the "heart", main feature and guiding principle of capitalism), "free wage labor" and the "pursuit of profit in continuous, rational capitalist operation".	continuous
He certainly looked quite brave And is from a noble house; I could read that on his forehead - He wouldn't have been so bold otherwise.	bold
Just think, the jewelry, bought for Gretchen, A Pfaff has snatched it away!	snatched away
The little one's cradle stood by my bed at night; it was hardly allowed to stir, when I was awake; soon I had to water it, soon lay it down to me; soon, if it did not keep quiet, get up from bed and prance up and down in the room, and stand at the washing trough early in the day; then at the market and at the hearth, and on and on as today so tomorrow.	away
It's as if no one had anything to do and nothing to do but gawk at their neighbor's every move, and they start talking like they always do.	gawk
The misery of this only one is churning through my marrow and life - you grin serenely at the fate of thousands!	serene
The student Anselmus (no one else was the young man), although he did not understand the woman's strange words, felt an involuntary horror, and he quickened his steps even more to escape the curious crowd's gaze.	inspired
The women forgave the well-educated face, whose expression heightened the fervor of his inner fierceness, as well as the youth's sturdy stature, all awkwardness and his out-of-fashion suit.	Growth
All the marvelous things he had seen had vanished from his memory, and he only remembered that he had talked all sorts of crazy things out loud under the elder tree, which was all the more appalling to him as he had always had an inner loathing of all self-talk.	Disgust
The student Anselmus was quite happy to accept this, because he believed that he could escape the evil fate that was now befalling him.	escape
But then, as he gazed wistfully into the water to see if the blissful eyes would not peer out of the flood, he realized that the glow came only from the lighted windows of the nearby houses.	preserved
But it did the student Anselmus good to be taken care of in the most distressing situation of being thought drunk or insane, and although it had become quite dark, he thought he noticed for the first time how Veronica had quite beautiful dark blue eyes, but without the wonderful pair of eyes he had seen in the elder tree coming to his mind.	dark
As usual, music was played after the frugal meal; the student Anselmus had to sit down at the piano, and Veronika let her bright, clear voice be heard.	Meal
The student Anselmus was full of heartfelt joy at the Registrar Heerbrand's request; for not only did he write neatly and draw with a pen, it was also his true passion to copy with painstaking calligraphic effort; he therefore thanked his patrons in the most obliging terms and promised not to miss the morning lunch hour.	miss
At last the dragon, swinging himself up and down, caught the creature that had sprouted from the lily, carried it up the hill and encircled it with his wing; there it was the lily again, but the lingering thought tore its innermost being apart, and the love for the youth Phosphorus was a piercing misery, before which the little flowers that had otherwise enjoyed its gaze withered and died, breathed upon by poisonous vapors.	Jammer
For the second time, those present burst out laughing, but the student Anselmus felt very uneasy, and he could hardly look into the serious eyes of Archivist Lindhorst without trembling inwardly in a way he himself could not understand.	incomprehensible
You may think what you like of me," said the student Anselmus, "you may think me a fool or not - enough! - At the door knocker, the wicked face of the witch of the Black Gate grinned at me; I'd rather not talk about what happened afterwards, but if I had woken up from my faint and seen the cursed apple woman in front of me (for no one else was the old woman who was busy with me), I would have been struck by the blow immediately, or I would have gone mad.	Female
"Esteemed Mr. Privy Archivist, here is the student Anselmus, who, extremely skilled in penmanship and drawing, wants to copy your rare manuscripts."	Manuscripts
The Archivist was in his special mood again today, tomorrow he will certainly be meek and not speak a word, but look into the vapor of his pipe or read the newspapers, you don't have to worry about that.	meek
May I ask you yourself, dear reader, whether you have not had hours, indeed days and weeks in your life in which all your usual activities and doings caused you a rather agonizing discomfort and in which everything that otherwise seemed quite important and worth bearing in your mind and thoughts now seemed unworthy of you?	downright
I may even ask you, dear reader, whether you have not had hours, even days and weeks in your life in which all your usual activities and doings caused you a rather agonizing discomfort and in which everything that otherwise seemed quite important and worth bearing in mind and thought now seemed trivial and unworthy?	ludicrous
This had plunged Angelica into the deepest sadness, but today she was cheerful to the point of exuberance, at which Veronika was not a little surprised and openly expressed it to her.	blatant
This had plunged Angelica into the deepest sadness, but today she was cheerful to the point of exuberance, which Veronika was not a little surprised about and told her so openly.	Exuberance
If, therefore, instead of fulfilling my wish, you want to tease me with your foolish, nonsensical chatter, you are doing me an injustice, for I have only wanted what I know you have granted to others.	tease
Anselmus walked confidently behind the archivist; they came out of the corridor into a hall, or rather into a magnificent greenhouse, for from both sides up to the ceiling were all kinds of rare and wonderful flowers, even large trees with strangely shaped leaves and blossoms.	rather
At table, the archivist Lindhorst was in a particularly cheerful mood; he asked about the student Anselmus' friends, the rector Paulmann and the registrar Heerbrand, and knew a lot of amusing things to say about the latter in particular.	Delightful
It seemed to Anselmus as if he were so completely embraced and entwined by the fair, lovely figure that he could only move and move with her, and as if it were only the beat of her pulse that trembled through his fibers and nerves; he listened to her every word, which resounded into his innermost being and ignited the bliss of heaven in him like a shining ray.	Delight
He approached; touched by his glowing breath, the lily opened its leaves, and he saw the lily's daughter, the green snake, slumbering in the chalice.	slumbered
The enraged prince of spirits seized the salamander in a rage and said: 'Your fire has died out - your flames are extinguished, your rays have gone blind - sink down to the earth spirits, who may tease and taunt you and hold you captive until the fire material reignites and shines up with you as a new being from the earth.	scoff
But I cannot hide from you that in the terrible battle with the salamanders and earth spirits, the black dragon broke free and roared away through the air.	roared away
Have I not only myself to blame for my misery, ah! have I not sinned against you, fair, beloved Serpentina? - Have I not harbored vile doubts against you?	disdainful
"Alas," sighed the student, "they never saw the fair Serpentina, they do not know what freedom and life in faith and love are, therefore they do not feel the pressure of the prison into which the salamander banished them because of their foolishness, their wickedness, but I, unfortunate one, will perish in shame and misery if she, whom I love so unspeakably, does not save me."	Disgrace
The vision in which I now saw Anselmus in the flesh on his manor in Atlantis was probably due to the arts of the Salamander, and it was wonderful that, when everything had faded away as if in a fog, I found it written down quite neatly and apparently by myself on the paper lying on the violet table.	apparent
Oh, happy Anselmus, who threw off the burden of everyday life, who stirred your wings in love with the fair Serpentina and now lives in bliss and joy on your manor in Atlantis!	stirred
But poor me! - soon - indeed, in a few minutes I shall be transported even from this beautiful hall, which is far from being a manor in Atlantis, to my little attic room, and the miseries of a needy life will occupy my mind, and my gaze will be enveloped by a thousand calamities as by a thick fog, so that I shall probably never see the lily.	look
As the Kuomintang simultaneously infiltrated provocateurs and spies into the Communist Party and launched an attack on the Soviet with 100,000 soldiers, the internal party struggles reached their temporary climax with the Futian Incident.	preliminary
While Chiang's troops were increasingly disintegrating due to corruption and the commanders' pursuit of personal interests, the Red Army fighters were fanatical.	fanatized
The fundamental changes that were planned for Beijing - including the demolition of the Forbidden City - were not implemented due to the political turmoil in the young People's Republic.	implemented
Despite the political disputes and repression, the economy stabilized, economic output returned to the 1936 level in 1953 and inflation fell to single digits.	stabilized
The farmers did not yet lose their land ownership, but were forced to share draught animals, tools and seeds, to cultivate the fields in small groups under the leadership of a cadre and to share the yields.	Yields
After further collectivization efforts were temporarily suspended in January 1955 with Mao's approval, they were intensified again from April 1955.	intensified
However, the anti-right-wing movement, which continued with varying intensity over the next few years, created an atmosphere in which few dared to criticize the government's political and economic course.	practise
In the eagerness to implement such measures in accordance with party guidelines, the advice of hydrologists was ignored for many measures and the work was carried out poorly.	executed
An irrigation project in the arid district of Xushui, around 100 kilometers south of Beijing, played a key role in promoting the people's communes.	arid
The leading Soviet agronomist Trofim Lysenko held the view that acquired characteristics were inherited and denied the existence of genes as unsocialistic and therefore wrong.	negated
After great euphoria in the middle of 1958, it became apparent at the end of the year that the expected increase in production in the agricultural sector would not take place to a sufficient extent and that a major breakthrough in this area would not be possible.	Breakthrough
The new Chinese Foreign Minister Chen Yi commented in November 1958, believing in agricultural yield increases in the face of humanitarian tragedies resulting from the Great Leap Forward:	Tragedies
In March 1959, Mao spoke of an excessive "wind of communism" that had prevailed and expressed admiration for the simple farmers who had resisted excessive grain levies.	exaggerated
These exports accounted for around 2.3 percent of grain production and are not considered by the majority of historians today to be the cause of the famine.	classified
At the first Chengchow meeting from November 2 to 10, 1958, the rosy mood of the summer had already evaporated.	evaporated
Marshal Peng Dehuai, who had previously made an extensive inspection trip to investigate the real situation in the country, stated that, according to his knowledge, agricultural production had decreased rather than increased.	extended
Organizationally, it was decided that the unit of account for the peasants' services would be taken away from the people's communes and transferred to the work brigades below them, in order to shift responsibility back to the grassroots of the peasants in the hope that this would better prevent excesses of the people's communes.	Excesses
Mao Zedong opened the meeting, which went down in history as the Lushan Conference, on July 2 with a speech highlighting the achievements of the Great Leap Forward and praising the enthusiasm and energy of the Chinese people.	pries
Wu Zhipu's power depended on the success of the Great Leap Forward; even a partial admission of the failure of this policy would have meant that Pan Fusheng's removal would have been unlawful.	unlawful
As the reports of famine became more frequent, but the party and state leadership were unable to ascertain whether these were isolated incidents or whether the famine was more widespread, it was decided at the end of 1960 that leading politicians such as Deng Xiaoping, Zhou Enlai, Peng Zhen, Li Xiannian, Liu Shaoqi and Mao should travel the country for several weeks, with as few followers as possible, to see for themselves.	Entourage
He snubbed Khrushchev not only with political attacks, but also by musing in the presence of numerous other leaders of communist parties that a nuclear war would wipe out half of humanity, but would help communism to triumph over capitalism.	eradicate
Mao was already heralding an era of perpetual joy and, in his exuberance, was predicting ever shorter times to catch up with England.	forecasted
