During these trips, they not only saw the catastrophic situation in the country, but also how party cadres acted as dictators and took unrestrained advantage of public property.	unrestrained
He launched a campaign that China must protect itself from revisionism from outside and prevent revisionism at home, and rallied left-wing radicals such as his wife Jiang Qing, Lin Biao, Zhang Chunqiao and Ke Qingshi.	embrasure
However, the period of fragmentation was also a creative time in which the intellectual climate changed through the confrontation with Western ideas.	Ideas
Shortly after Japan's capitulation, Mao Zedong negotiated with Chiang Kai-shek in Chongqing[51] about settling their differences without success.	Contrasts
The takeover by the Communists was not an overthrow brought about from outside, but an upheaval supported by a broad majority in China.	worn
However, breaking with traditional rural cultural practices or teaching rural women about the law came up against obstacles that were difficult to overcome.	Hurdles
The flip side of the anti-corruption campaign is a civil service that is only partially functional, as it no longer makes decisions because the fear of being accused of corruption paralyzes civil servants.	accused
Both in a draft of the Wealth of Nations and in the Wealth of Nations itself, Smith states that in modern society property is unequally distributed, that property income is often based on the labor of others and that the state protects these conditions; but Smith resolutely counters this with the advantages: thanks to the division of labor, the standard of living of even the lowest classes is rising and real wages are higher than in earlier times, which preceded private ownership of land and the accumulation of capital, so that the worker owned the entire product of his labor.	decidedly
After all, the capitalist mode of production and its imperative of profit maximization tend to undermine their own foundations, nature and the worker, by exhausting both prematurely if they are not prevented from doing so.	undermine
An entrepreneur who is the first to introduce an innovation with which he can, for example, produce more cheaply than his competitors, can sell at the market price in order to achieve an entrepreneurial profit; however, this profit will be contested again: on the one hand, by imitators who eliminate his monopoly position and, on the other hand, by increased costs of the corresponding production factors, as the demand for them increases.	cancel
It is by no means to be equated with the "pursuit of maximum profit",[206] rather it contributes to taming the irrational drive for unbridled acquisitiveness.	unrestricted
His dedication and tactical overview quickly made him a sought-after military authority.	Instance
I had grown old enough to realize that the Sandman and his nest of children in the crescent, as the waiting-woman had told me, could not be quite true; but the Sandman remained a dreadful spectre to me, and horror - horror - seized me when I heard him not only come up the stairs, but also violently tear open my father's parlor door and enter.	Horror
When I saw this Coppelius, it rose horribly and dreadfully in my soul that no one else but he could be the Sandman, but the Sandman was no longer the bogeyman from the old wives' tale, who brings children's eyes to the owl's nest in the crescent moon - no! - an ugly ghostly fiend, who brings misery - misery - temporal, eternal ruin wherever he intervenes.	Fiend
"Let the boy keep his eyes and run his course in the world; but now let's observe the mechanism of the hands and feet properly."	observe
The despicable, loathsome Coppelius stood before me with glittering eyes and sneered at me, trying in vain to get rid of his image.	aspired
The explosion had woken the neighbors, the incident became known and came before the authorities, who wanted to call Coppelius to account.	pre-request
If I now tell you, my dear friend, that that weather-glass merchant was the wicked Coppelius, you will not blame me for interpreting the hostile apparition as bringing serious disaster.	fool
The uncanny goings-on with your father at night were probably nothing other than that they were both secretly conducting alchemical experiments, with which your mother could not be satisfied, since a great deal of money was certainly being squandered in vain and on top of that, as is always the case with such laboratory assistants, your father's mind was completely filled with the deceptive urge for high wisdom and was turned away from the family.	averted
It is the phantom of our own self, whose intimate relationship and deep influence on our mind throws us into hell, or raptures us into heaven.	enraptured
I am very unhappy that Clara vomited and read the letter to you the other day, admittedly due to my absent-mindedness.	Absentmindedness
Indeed, one should not believe that the spirit that shines out of such bright, smiling child's eyes, often like a sweet, sweet dream, could distinguish so intelligently, so magisterially.	distinguish
The disgruntlement that (I must confess) wanted to master me after the fatal letter of understanding will then be gone.	master
Clara was therefore scolded by many as cold, unfeeling, prosaic; but others, who had a clear understanding of life, loved the cozy, understanding, childlike girl immensely, but none so much as Nathanael, who moved vigorously and cheerfully in science and art.	Cozy
Nathanael, quite enraged that Clara was only stating the existence of the demon in his own mind, then wanted to come forward with the whole mystical doctrine of devils and horrible powers, but Clara broke it off in frustration by interposing something indifferent, to Nathanael's no small annoyance.	weary
Soon, however, the whole thing seemed to him to be nothing more than a very successful poem, and it seemed to him as if Clara's cold mind must be inflamed by it, although he did not think clearly what Clara was inflamed for, and what it should actually lead to, to frighten her with the horrible images that prophesied a terrible fate that would destroy her love.	prophesied
It struck him at last that Olimpia often sat for hours at a small table in the same position in which he had once discovered her through the glass door, without any occupation, and that she seemed to be gazing steadfastly at him; he had to confess to himself, too, that he had never seen a more beautiful growth; but, Clara at heart, he remained most indifferent to the stiff, rigid Olimpia, and only now and then glanced fleetingly over his compendium at the beautiful statue, that was all.	sometimes
The artificial roulades seemed to Nathanael the heavenly exultation of a mind transfigured in love, and when at last, after the cadenza, the long trillo rang out quite resoundingly through the hall, he suddenly could no longer hold himself, as if seized by glowing arms, and had to cry out loudly in pain and delight: "Olimpia!"	barked
Although the professor had done his utmost to appear splendid, the merry heads knew how to tell of all sorts of unseemly and strange things that had happened, and they were particularly fond of the dead-eyed, mute Olimpia, who, regardless of her beautiful appearance, was accused of total stupor and the reason why Spalanzani had kept her hidden for so long.	Unseemly
Nathanael heard this not without inward wrath, but he kept silent; for, he thought, would it be worth while to prove to these fellows that it was their own dullness that prevented them from recognizing Olimpia's deep and glorious mind?	Dullness
Oh! I know it, that proud, scornful expression that would disfigure even a graceful face!	disfigure
You, Conti, have done all the good that art can do with the Countess's large, excellent, staring, fixed Medusa eyes.	honest
You have transformed pride into dignity, scorn into a smile, and a tendency to gloom into gentle melancholy.	Melancholy
Afterwards I only encountered it again in holy places - where it was less appropriate to gawk.	ziemt
She said the most melancholy things with the funniest manner: and again the most ridiculous antics with the saddest expression.	antics
A girl without fortune and without rank knew how to pull him into her snare - with a little larva, but with a lot of pomp of virtue and feeling and wit - and what do I know?	Splendor
Only that you, Marinelli, who so often assured me of your most intimate friendship - O a prince has no friend! can have no friend! - that you, you, so faithless, so malicious, should be allowed to conceal from me, until this moment, the danger that threatened my love: if I ever forgive you for this - I shall be forgiven for none of my sins!	Moment
It occurs to me - at this hour (looking at the clock), at this very hour, the pious girl used to hear mass every morning with the Dominicans.	Trade fair
A courtesy becomes a sentiment, a flattery becomes an affirmation, an idea becomes a wish, a wish becomes a resolution.	Intention
But pregnant with so much bliss for me - may it be this bliss itself that makes me so serious, that makes me, as you call it, my lady, so solemn.	solemn
That means practicing his craft very cruelly - and messing it up.	botch
Rather relax and rest in a room where there is more comfort.	step
And could I but declare this coincidence, which once more, before all my hope vanishes for ever, gives me once more the happiness of seeing and speaking to you; could I but declare this coincidence to be the hint of favorable fortune - the most wonderful postponement of my final condemnation, so that I may once more implore your mercy: I will yet - do not tremble, my lady - depend solely on your gaze.	Postponement
Is it heedful to base the accusation of a righteous man on a sound heard in a moment of terror?	found
Not brave enough to murder with one's own hand, but unworthy enough to murder for the satisfaction of another's titillation!	Tickles
Do you think it's proper to have a miserable snack with you here in the antechamber while the prince is waiting for me in the chamber?	Made
For learn, gossiping courtier, learn from a woman that indifference is an empty word, a mere sound that corresponds to nothing, nothing at all.	Sound
As gracious as he is towards your wife and daughter - they are ladies - will your unexpected sight therefore also suit him?	located
Or it is not true - it is not true that you are of that good species of madwomen so worthy of our pity and esteem - you are a common fool.	Törin
If he is soon driven from lust to lust by satiety and disgust, the memory of not having paid for this one pleasure will forgive him the pleasure of all of them!	Indulgence
Here, the strictness of the law can easily be combined with respect for blameless virtue.	unite
There was once a father who, to save his daughter from disgrace, sank the first, the best steel into her heart - and gave her life for the second time.	lowered
Perhaps you expect me to turn the steel against myself to conclude my deed like a stale tragedy?	shell
Only the rigorous deployment of provincial and municipal administrations, shortages in food supplies and the introduction of curfews aroused unease among the Belgian population against the occupation regime.	Discomfort
The relocation of a commando or staff usually took place at night via remote country lanes.	remote
Saboteurs were often women, young people and older men who achieved their goals less through muscle power and more through cunning: Instructors like Nancy Wake, who were trained by the British Special Operations Executive, taught them how to plant incendiary bombs, fix explosive charges to railroad tracks, render goods confiscated by the occupying forces unusable, silently strangle a person, disassemble, clean and handle weapons.	handles
Although she had not acted as part of the political-military Resistance, she was subsequently accorded great symbolic significance because she had given the Resistance a voice.	measured
He came from a distinguished family: his maternal grandfather was the Democratic politician John F. Fitzgerald, who served as a congressman and mayor of Boston and became considerably wealthy as a newspaper publisher, while his paternal grandfather Patrick Joseph Kennedy was elected to the Massachusetts Senate and House of Representatives and was active as a liquor dealer and small banker.	Prosperity
Kennedy was critical of the legacy of Roosevelt, who had died in April, consisting mainly of the New Deal and increasing liberalization; his family's ties to the Democratic Party stemmed from the Republicans' hostility towards the political influence of Irish-Americans.	stirred
In view of her death and the rumors about her liaison with his brother Robert, the rumored connection with Monroe led to a great deal of speculation about the involvement of the American secret service.	Speculation
When Kennedy asserted in November 1957 that he had no ambitions for the White House, this was greeted with a grin in the capital.	Smile
Her fashionable style and fluency in French, Italian and Spanish made her so popular not only in America but above all in Europe that Kennedy recognized her as an important political asset.	Trump
At the climax of his triumphant parade through the city, accompanied by more than a million Berliners[146] - and impressed by his detours to the Berlin Wall at Potsdamer Platz and Checkpoint Charlie - Kennedy gave a pointedly anti-communist speech at the Schöneberg town hall on what was then Rudolph-Wilde-Platz.	pointed
The historian Jürgen Heideking (1995) concludes that the fascination with Kennedy had deeper reasons than his tragic end.	tragic
Even assassination attempts against Castro were attempted and the faking of acts of terrorism and military incidents (Operation Northwoods) as a pretext for an invasion of Cuba was considered.	Invasion
Encouraged by these words, with a burning desire in his heart, Nathaniel decided to go and see Olimpia the very next day, so that she would say in no uncertain terms what her lovely eyes had long since told him, that she wanted to be his forever.	everlasting
In the meantime, good fortune had returned to the house, for an old, meagre uncle, of whom no one had hoped for anything, had died and had left his mother a small estate in a pleasant area not far from the town, together with a not inconsiderable fortune.	remote
There his two mothers, the queens of France and Hungary, wiped their eyes with emotion; when you see one of them still raising her hand with the cloth, it is as if she were weeping over herself.	up
Those who love justice should take up their clubs to destroy this monster of the night.	redeem
That is the advantage of us disreputable, haggard people, that what others, scarce and sorrowful, must share daily with wife and children, we enjoy to the full with a friend, at the appointed hour.	Full on
I recognize his neck in iron, and because he has behaved improperly against his judge, I throw him into the barred prison.	Throw
He is suspended from his office, and I appoint you, until further notice, to administer it here in the town; but the funds are right, as I hope, I will not force him to desert.	Disposition
His grief consumes the next happiness from his lips, his thoughts always swarm downwards to his father's halls, where the sun first opened the sky before him, where his fellow-born ones playfully tied themselves tightly and firmly together with gentle bonds.	Halls
Do not leave him to himself, O leave him to himself, lest resentment ripen in his bosom and bring you horror, lest you remember my faithful counsel with remorse too late.	Remorse
As long as revenge possessed my spirit, I did not feel the desolation of my home; but now that I return satisfied, your kingdom destroyed, my son smelled, nothing remains for me at home to regale me.	ergoetze
These are the ancestors of your priestess; And much unhappy skill of men, Many deeds of the twisted mind The night covers with heavy wings And lets us see only in dreadful twilight.	Sense
