A group of people set fire to this rotted Benaya tree near the road yesterday evening (06) and as soon as there was a danger of the tree falling across the road, a group of officers including Kandaketiya Police Station Commander Police Inspector WM Siriwardena searched the area until dawn yesterday (06). Pedestrians have been protected by the tree as they struggle to put out the fire.	Russia
After becoming the only hope of the common people by protecting the farmer, worker and fisherman who represent the little man of the whole island of Sri Lanka, I will make the lives of the people happy.	the island
A large number of monkeys, who have filled their bellies with the food provided by the devotees including flowers, are now seen starving due to the lack of any food.	hunger
Due to this situation, the local residents have informed the relevant authorities that the villages beyond the reservoir such as Opalgalala, Galbodala Ambana and Naula will also face many difficulties in the future.	outside
In this season, 80342 hectares of paddy fields have been cultivated in Kurunegala district, 16989 hectares of paddy under major irrigation, 36809 hectares of paddy under minor irrigation, and 26544 hectares of paddy under sky water.	the sky
On the one hand, people's lives are in danger due to coconut oil fraud.	the trick
Bodu visual art objects are the characteristics that make the cultural environment of Heladiva colorful.	Heladiva
The island of Hawaii is a magical island perfected by a set of unique socio-cultural religious environment and geographic complexities that have captivated the hearts of most tourists from America.	Spectacular
Several agreements will also be signed between the two countries this evening.	In the evening
(Mudita Dayananda) Secretary General of the United People's Freedom Alliance, Minister of Power and Energy Mr. Mahinda Amaraweera said today (13) that no matter how severe Idora is, electricity will not be cut and people's lives will be disrupted.	the room
Nishan Pradeep Karunathilaka, who works in the Police Special Task Force and has conquered the trinity of Air, Water and Earth, proving that the saying that one of the world is one thing is wrong, is a perfect sportsman with real talents.	Dikvijaya
History shows that the champions of great wars who won the world, the great Narapati who ruled the Sam kingdom, and the fierce veterans who sacrificed their lives to get liberation, are crying in love.	Narapati
In particular, knowledge about the biography of Sri Vajiranana Na Thero, historical information of the country, foreign invasions and the challenges that arose in them, national destructions etc. can be seen and learned through this exhibition.	Historical
After about two weeks of residential treatment, Kalana Hastia will have the opportunity to walk freely in the area like other elephants.	the elephant
(Kushan Jayawardena) A wild elephant calf which was unable to take food and water for several days due to severe mouth injuries caused by eating Hakkapatas died today (28) at Balaluwewa Ismatta due to severe hunger and dehydration.	hunger
Why did Prince Dutugemunu separate his couch for Suranimala like that?	the couch
Damitha is a thirty-three-year-old unmarried woman living in Kuliapitiya. He and his mother were the only family members. Damita took care of a cultivated land as protection.	protection
After working hard all day, the two of them finished work and in the evening they went to the city which is a little far from their village to get rid of the tiredness of the day and warm up their bodies.	tiredness
In the first 48 months of being the President, I will start the era of renovating large irrigation systems, medium irrigation systems and minor irrigation systems not only in Wellassa town but in the whole of Sri Lanka and making the fields fertile.	fields
If mental distress continues for a long period of time, it can progress from affecting daily life to suicide.	Domnasa
Even though she smiled, the little girl's eyes were filled with tears.	in the eyes
Due to the loss of their master, they have been put in a situation where they have to sell their bodies to survive.	body
A spectacular meteor shower can be observed tonight (18) said the lecturer of the Sri Lanka Planetarium Dr. Geetanjana Vanigasekara.	Spectacular
The station commander, who understood the need, arrested him for questioning on suspicion of driving a motorcycle under the influence of alcohol, driver and without a revenue license, and released him on police bail, placing the casket of the parade on the back of the elephant and telling him to appear in court for the three charges filed against him. Set the date.	the elephant
Mr. Arvind Kumar, State Minister of Education, said that the ``Presidential Study Scholarship'' program implemented for 2024/2025 as a concept of President Ranil Wickramasinghe will be of great help to successfully carry out the educational activities of school children with economic difficulties.	great
What is love but love itself? What is love but love itself? What is dating but dating? Since time is only one arbiter. Evening is in one place. In the evening, the dawn is another place.	the morning
In the election, the people gave a good answer to those who do not understand the mind of the people.	nice
He has gone to see his wife saying that he is going to friends' houses.	the wife
Some Marxists objected that this would divide the country and divide the proletariat.	Proof
The police said that they violated quarantine rules and traveled in three-wheelers without keeping a distance.	remote
The lorry with the crane is a contract vehicle of Halawata Electricity Board and the cab is a private vehicle traveling from Vavuniya to Colombo.	a car
It is a news that a worshiper who came to listen to a full sermon in a neighboring house went to steal a pair of shoes of the Lord who had come to preach and was caught by the same Lord who had come to preach.	Neighbor
President Ranil Wickramasinghe emphasizes that the extensive trade and economic relations between Sri Lanka and India should be strengthened again so that both countries benefit.	quickly
There is a 45-feet long stone reclining idol, an eight-feet tall Samadhi idol, a book cave, a padhanaghara, meditation chambers, and cave paintings said to be from prehistoric times.	Style
(Jude Samantha) Additional District Judge and Magistrate Rakitha P. ordered to remand a police constable till April 24th who allegedly assaulted his adulterous wife and cut her wrist.	Charter
When natural calamities like this happen, even if you talk about it for a few days, you forget about it after that.	calamities
(Apsara Yosith Wijesuriya) Ratnapura Public Health investigation officers said that a manager of a Ratnapura Bojunhalla who sold it was arrested today (13) on suspicion of having a piece of cloth in a parcel of rice brought for the lunch of a high official of the Ratnapura High Court.	Bojunhalaka
The police have arrested a large number of people who have nothing to do with the Hambantota protest.	large
The cloves are harvested these days and the farmers also say that the cloves are rotting because there is not enough sunlight to dry the cloves.	Rashmi
A 28-year-old mother of two, a resident of Halawatha-Ambakadawila, has complained to the Halawatha Police that the suspect attacked her and cut her hair.	Charter
The development of the Northwest Canal including the Kalu Ganga, as well as the reconstruction of 600 tanks in the development of the North Central Grand Canal, as well as many historical transformations in water management.	Historical
Adding Jackson Anthony to the fine examples of the strength of our country such as Martin Wickramasinghe, Mahagamasekara, Amaradeva, Joe Abeywickrama does not break that line. More excited. can be understood.	nice
Some places in Nuwara Eliya will be covered with flowers in the morning	in the morning
Tears fell from the eyes of the lady who saw the women laying on the ground on both sides of the road leading to the stage and releasing the long ropes on the road.	Charter
At the same time, programs are established to create short-term livelihoods in the areas.	Livelihood
When the rightful owner got his national identity card, his happiness appeared in the mind of this worker, meanwhile, the worker's heart was filled with sadness.	happiness
But the great warriors born in this motherland were able to sacrifice their lives to liberate our motherland.	Great
Medicines are given only as a support to it.	a help
The king who heard the Chullahattipadyopama Sutra during the Mihintala Pava, located in the Pancha Seela with Tisarana, becomes a Buddhist, directing the people to the true path that removes the illusion of ignorance.	sins
Mr. Mahinda Siriwardena, Secretary of the Ministry of Finance, said that when he was in the Finance Board for two years, he saw the danger of the country falling apart and he suffered a lot to correct it.	wife
There, the school students expressed their condolences for the death of Mr. Pandit Amaradeva.	sadness
Sivali Pirith lecture, Katina Maha Perahara, Sambuddha Puja, Kapraka Puja, Katina Vastra Puja Pinkam were held there.	Clothes
The well-known Lonely Planet magazine chose Sri Lanka as the best country to visit this year.	known
● This song has become a big controversy now, isn't it?	to a controversy
Wildlife officials say that this 35-year-old elephant is nearly nine feet tall and its tusks are nearly four feet long.	pairs
(Sithum Chaturanga)            Condemning the bomb attacks on several places including Christian churches and condoling the loss of lives, the traders community of Mannar closed their shops and hoisted black flags and engaged in a hartal campaign today (22).	sadness
The current political situation in the country and future political activities were discussed.	Badun
They proved that the theory of development and destruction of the exploitative society invented by the founders of Marxism also applies to the capitalist society. The first chapter of this book titled 'Capitalist Class and Proletariat' is dedicated to prove that truth theoretically.	capitalist
Another important event that took place on Poson Poha Day was the ordination of the Bhanduka worshiper at the Mihintala ceremony.	sins
He said that 80 percent of the workers working in garment factories in the north are women and they contribute a lot to the economy of the household.	in the house
The Free Media Movement further states that such events, which are considered as derogatory treatment of professional journalism, are obstacles to the existence of democracy and therefore, without taking this incident for granted, the authorities are requested to conduct a fair investigation as soon as possible.	As soon as possible
I also decided to uplift the destroyed economy immediately after this disaster.	quickly
The children of the Sri Lanka Buddhist Vihara Dhamma School and the Sinhala Pathashala in Paris presented a variety show called 'Lak Children'.	College
Born in Kurunegala - Kumbukgate - Pahala Vatuawa area, this baby girl is one year and 9 months old.	toddlers
( +++ Sujith Hewajuli's) A number of audio tapes are circulating on social media these days, which purport to include the conversations of former state minister Mr. Ranjan Ramanayake making phone calls to various people, and these conversations have caused a lot of controversy in the country.	to a controversy
After undergoing surgery at the Colombo National Hospital, the patient underwent emergency surgery yesterday afternoon to remove a part of a device stuck in his body.	body
Valentino Rossi is the pride of Italy who conquered the motorcycle track.	Dikvijaya
A lot of lives were lost in the 88/89 era because of those words.	large
Yesterday evening, a toddler who was seen flying kites fell into a well and died.	In the evening
The leaves of Russa trees were all around and there was a very desolate atmosphere.	Russia
In order to rapidly expand its coverage for the communities living in remote villages as well as to meet the sudden high demand capacity in urban areas, Dialog uses technical strategies such as Lamp Pole.	outside
At the same time, he must keep the auspicious casket on the elephant's back for auspiciousness.	the elephant
In our country, we see that if we take Mahaweliya, the brown water goes out as if the heart of our body is being stripped bare.	of the body
Throughout history, written by powerful groups, women have been modeled as beautiful or ugly objects.	the woman
Every country in the world faces such natural disasters.	to calamities
Also, we are introducing an easy method of insuring the crops of every farmer to provide immediate compensation in the future.	immediately
We received a sensational news from Kurunegala area about a little girl who was born without the anus, which is one of the organs of the excretory organ system.	a toddler
By using new technology methods, the fishing industry is not only being built in a way that does not harm the solar resource, but the 200 nautical miles from the coast is being utilized in our country.	the sea
Lord Buddha visited Sri Lanka for the second time on this Poho day, ennobling the island of Sri Lanka for the second time with Sambudhu Siripa Pahasin.	the island
The colorful awards evening for awarding excellence in the media industry was held in a grand manner on Tuesday afternoon, 13th December 2022, at the Empire Ballroom of the Galkissa Maha Hotel.	Evening
This aquifer has been nourished by the blood shed by those noble warriors so that the trees in all the four corners of the island of Sri Lanka become green and vibrant.	the island
By worshiping Sati Pirith, it is prayed that the evil dangers of the country will be removed and fertility will arise.	Hazards
Na Thero of Trincomalee, whose virtues were the first lesson of his practice,	don't like
A livelihood development program is also implemented for every household.	Livelihood
Kandy National Hospital, Kandy National Hospital's Specialist Surgeon A. H.M.K. Mr. Abeysinghe says.	the father
Every time the war is remembered, the occasions when they sacrificed their lives in their great fighting, the occasions when they lost their limbs and became disabled, and the tragic situation where their children and families were helpless, when we carefully study all of them, the Republic of Sri Lanka, the entire Sri Lankan people, and the entire nation pay respect to those war heroes today.	Great
When this group was looking for the related herbs, a knowledgeable person informed them about other hazards that may occur from taking too much of one particular herb, but this group believed the face rather than his opinion.	Hazards
"""M."	Main
Lava falling into the ocean creates a number of unique hazards that can seriously injure or kill people in nearby water without realizing it, according to the US Geological Survey (USGS).	Hazards
I have revealed the real situation of this taxation in the book 'Tax Hunt'.	From the book
Kusum Baduna was auctioned and at the same time a bottle of alcohol was put up for auction as the elixir of the village.	Baduna
After that, he went on a day and discussed about the offerings and other materials needed for the sacrifices to be done on the house and the land.	offerings
He said that the deer, which had been shot by a hunter with a firearm, died when the wildlife officers came and took it to the Nikaverati veterinary office for treatment, following a report from a neighbor that it was biting by dogs.	Neighbor
Long ago, when animals also had kings, our Great Bodhisattva was a certain golden swan king and was the leader of the birds.	Gold
The office said that a lorry with 1000 kilos of grains and vegetables including chickpeas, vatana and greenpeas was taken into custody.	a car
The farmers also say that even the water needed to carry out agriculture, which is their only means of livelihood, is being managed with great difficulty from the sky water received in the Mahakandara lake.	from the sky
And through this, some people will have the opportunity to serve the institution remotely, from the safety of their homes, and it will help to reduce the development imbalances between the provinces of the country.	to support
We are getting all the information about this inferior fuel scam.	in Magadi
Kurunegala District Member of Parliament Mr. Johnston Fernando: Your presence in Kurunegala district and this place which is at the corner of Kandy district has great respect for the people of Mawathagama.	corner
They demanded that the six-kilometer road from Attanakadawala, Bingemuduna to Jayasiripura, Sarubima is dilapidated due to non-repair for a long time and it should be repaired immediately.	immediately
It would be a great mission to train them and bring out their own dance art.	a mission
With the intention of supporting his wife, children and elderly parents by renting a three-wheeler on the basis of lease installments, he made a living for his family due to the unremitting efforts of not only him but also his wife.	the wife
With our support, he took steps to concrete every road in this plantation, provide electricity to thousands of plantation houses, provide good houses instead of lime rooms, and improve schools in his area.	Area
Dead bodies of the birds killed by the cutting of the Bo tree were seen around the railway line and around the Colombo-Kurunegala main road, and passers-by said that the hatched birds were wailing on the trunk of the tree.	the tree
In this regard, Sarath Chandranayake, Assistant Director of Fisheries, Puttalam, said that due to the use of nets, the aquatic system and aquatic life of the sea and the lagoon will be greatly damaged.	Sea
But now most of the world knows that these disasters are no longer natural disasters but unnatural man-made things caused by climate change.	calamities
Friends, although the people of Arumugam Thondaman family had temples and churches in their area, they did not make them a problem.	Area
The spread of the fire has accelerated with the strong sun and wind.	Rashmi
All MPs took the MP oath and signed the MP book.	In the book
Without asking about it at once, he fell into conversation with the wife of the housekeeper after drinking tea.	the wife
Those roads should be built very quickly.	quickly
While working at the Kurunegala Teaching Hospital, Dr. Shafi was accused by various parties of having sterilized mothers and that incident led to a controversy.	to a controversy
It was even lined up in the theory book of the Parliament.	the book
The same sad poem written at the beginning of the spring of 2020 will leave the people of my country in the middle of the summer of 2021.	Summer
It takes a long time to dry off after bathing.	Charter
A performance has now started to cover up this trap.	the trick
Poverty/poverty alleviation Poverty alleviation is an important outcome of basic income stabilization.	Poverty
Valentino Rossi, who conquered the international motorcycle circuit for twenty-six years, is considered to be an extremely elegant rider.	Dikvijaya
Among the crowd, two gamblers ran towards the Gurugalle New Bridge on the Kelani river.	in the river
"By giving the amount for the crop loss, we will make history as the first government to provide crop loss compensation to the farmer immediately,"" said the minister."	As soon as possible
The head of the establishment, who did not show any arrogance, treated the higher-ranking officials as well as the lower-ranking worker in the same way.	arrogant
On April 5, 1971, when the rebellion started, Somawansa Amarasinghe was charged before the Criminal Justice Commission with planning to attack the Rosemead house, the private residence of the then Prime Minister.	residence
When the rupee depreciates against the US dollar, darkness dawns on one side of the society.	the darkness
Leaders of many other countries expressed their condolences by phone.	sadness
The police have also seized two shovels, two shovels, a pickaxe and a three-wheeler in which these people used to dig for treasure.	a car
The father told a neighbor who inquired about this that the son who ran away the next morning made a phone call to ask about his well-being and then tears fell from his eyes and there was no anger or hatred towards his son.	with the eyes
A golden dress will be made for Raja Hasthiya, who is going to carry the eternal casket procession in the Esala Perahara of the Talada Palace in Kandy.	the elephant
The relative, who was engaged in amicable and happy marriage, went to sleep very sleepy.	sleepy
The teacher who received the money put a string on her shoulder and gave a copper leaf, 'In two weeks the girl will come to you.	teachers
(Augustine Fernando) The Halawata Unit of the Sri Lanka Coast Guard Department said today (7) that 6 people were arrested in two one-day vessels who were bringing two day-trippers ashore after catching and killing two whip sharks, a marine creature that is under threat of extinction. says.	In Diyamba
Due to the dense forest, the darkness was doubled.	the darkness
Italian businessman Cattoni Giancarlo brought this two and a half feet tall and 180 kg ancient stone Buddha statue from Borobudur, Indonesia and offered it to the temple.	Style
We are working to provide about 400 million for 150 ancient Rajamaha temples.	ancient
Although the attacks on people are minimal in the forest where they live, people are also tempted to attack the villages by damaging the crops from time to time.	residence
The Sara Samhita book of Parliament was presented to the Speaker by Prime Minister Mahinda Rajapaksa here.	the book
We thought that it would be possible to maintain the economic growth rate at 3 to 3.5 percent in the face of all disaster loan payments.	calamities
Many avenues of livelihood are opening up through the development of agriculture in the central areas.	Livelihood
May the Abhinava priests receive the protection of Lord Dalada, Sri Maha Bodhi.	Security
(Augustin Fernando) Halawata Police say that a suspicious fishing boat that came floating in the distant sea was brought to the shore of Iranawila today (2nd) by a group of residents of Halawata.	In Diyamba
This human society has become inhumane to the extent that children born from their own blood are married.	the wife
"The book ""Kavantissa Program"" written by Mr. Varuna Chandrakeerthy was launched today (22) at New City Hall, Colombo."	the book
Due to the heavy storm, the school was not held today. I marked the names of the 31 children who came and opened them at 11 am.	Chanda
At the same time, we ask the Mahanayake Theros whether there is a country where our Buddhist people can live with wisdom according to the Aryasthangika path.	with wisdom
I am mentioning here that anti-corruption is the self-defense of a country.	self defence
Edward Chandrasiri's latest book Rasin Sapiri Malay Bojun will be released on September 2nd at the Public Library Auditorium.	Bojun
Apart from the tax exempted from the temple, church and temple, the tax is also going to be imposed on those who earn foreign exchange from the farmer.	outside
After the government's sugar scam, the coconut oil scam has been implemented.	From Magadi
Nishantha Fernando, the world champion and the national carrom champion for many years, won the third place this time.	the champion
In the end, King Dutugemunu thought of a strategy to drive away Swarnamali Divyangana from the golden Thelambu tree. Legend has it that King Dutugemunu begged her and made her leave the new pagoda after her promise to build it and built its pillar.	Divyangana
His inspiration was a great help to me when I edited the foreign page.	Help
An affair ends in murder.	by murder
Even today, the great disabled soldiers are at their homes with their guardians in our military welfare centers.	Great
Also, this morning, a health center was opened in a very remote village in Megaswewa area, at the far end of Midrigiri.	corner
"""The centenary of the Russian Revolution is being celebrated this year in an almost completely different historical background."	Historical
Various social, human and psychological researches have also been launched by various individuals, organizations and institutions related to this greeting which has a strong spread globally.	good
For example, there are false accusations that forests are being cut and the environment is being destroyed for the sake of the village program.	Incorrect
This book is published by Fast Publishing Pvt.	the book
Also, we focused on distance education in the past.	remote
Recently, there was a ceremony to offer a stone Buddha statue to Modena Maithira Temple in Italy.	Style
Almost no book has mentioned for sure when and who started this rafting ritual.	The ritual
But we will end this fight by protecting free education and free health.	corner
Those goals include ending world hunger and poverty, improving incomes and education worldwide, and increasing access to clean water and sanitation.	Poverty
A 10-day visual and acoustic survey will explore and document cetacean diversity in this remote part of the ocean. The survey team combined daytime visual surveys with 24/7 acoustic surveys to get an idea of ​​cetacean life in the area. .	area
As if expressing condolences to those people, we remembered and thanked the people who died in the disaster here today.	sadness
Along with the three suspects, some equipment including shovels and shovels used to dig for treasure and a lorry and a cab in which they came have been taken into custody by the police.	a car
Bunches of smiling flowers were growing all over the young people's faces, and the happiness that flowed through the awakened eyes seemed to be unstoppable.	Dayana
