Today (15) it started raining in Kataragama and Colombo ending the Idora which affected the people of Ruhuna who were suffering without a drop of water and the people of Colombo who were suffering from severe heat.	the room
During my time, I was able to do a lot of work in preventing corruption and irregularities.	large
Sri Lanka Educational and Cultural Center in France, which runs the Sinhala language school in Paris, will hold the annual Weera Puranappu Challenge Elle competition for the eighth time next Sunday (22) at 10 am at the usual Bagatale Stadium near Paris, said Mr. Ranavi Bandara, the president of the center.	College
God did not look at their faces because He had seen how they sold His name and took alms from innocent people and killed themselves to share them.	offerings
Covered with wild russa trees since the 10th century, it was preserved after the establishment of the Central Cultural Fund in the early 80s and opened to local and foreign people on May 15, 2009.	Russia
Last week, an interview of Ruhunu Maha Kataragama Temple Basnayake Nilam was published, in that discussion, which caused a lot of controversy, he said that devotees should not donate large sums of money to Ruhunu Maha Kataragama Temple. What is your opinion about that?	to a controversy
If you don't have wings and want to fly, you don't belong on this earth.	like
This led to a controversy when the lyrics for the song aired.	to a controversy
With the removal of the telephone lines, a stone board has emerged that was covered with the concrete pole that held the lines until then.	Style
A wonderful news is heard from a town in Galle district that the person who invited Susil Priyanthaperahare to place the auspicious casket on the elephant's back had to go to Peraharin police to fetch him for it.	the elephant
Yesterday (14) Oddusudan police officers managed to stop a tipper which was not stopped by two policemen.	a car
He saw that his clothes were among the leaves of Eki Neka.	Badun
Underworld and drugs are the main topic of major media networks.	Main
(K Buddhika Kumarasiri) The Religious Organization for National Unity has announced that a truth action will be held on the 6th at 6 pm on the basis of all the religions of the country, Buddhist, Hindu, Muslim and Christian, in order to make everyone understand the truth about the interference of foreign forces in the country. Co-Convener Waripaha Somananda Thero said.	the woman
The era of restoring the tanks and making the fields fertile begins.	fields
After the dust from the moon landing settled again yesterday evening, a window on one side of the Vikram lander was opened to prepare a ramp for the Pragyan rover to glide onto the lunar surface.	moon
'It's amazing that the iceberg is still one big block of ice! Radar images show large eruptions now taking place in Hime Pow.	sins
I am trying to make that change.	change
The Kilinochchi wildlife officials who visited the place and conducted the investigation said that there were many bullet holes all over the body of the wild elephant that had died after being hit by the train.	body
Some time ago this was called the greenhouse effect, but now it is called climate change.	change
He also said that because of the power cut, it is not possible to get even water to the sick monk center, so no matter how many explanations were given to the officials who came to cut the power, the power went to cut off.	sick
Paddy and hay farming is the main livelihood of the people.	Livelihood
It must be said that a lot of work was done to revive the life of the people during the calamity.	calamities
Mother Pattini does many good things not through teaching.	mother
Foreign sources say that steps have been taken to lower the water level of the lake as one of the steps in the agreement made between the United Nations and Nepal to provide support to reduce the damage caused by climate change.	By change
A large number of frauds occurred in the north of the brook between southern India and northern Sri Lanka.	Magadi
'I think that gentleman has come to this temple more than him, even though he is an outsider,' said the leader, looking into his eyes and heating his brain.	the teeth
Then he escaped from the strugglers and arrived safely in a bus from Colombo to the village not far from Kurunegala.	sleepy
This water filtration system, which provides free drinking water to the people of Dalua and surrounding villages in Kalpitiya Peninsula, was built at a cost of fifty lakh rupees at the expense of the Navy.	the island
The complainant claims that this older sister attacked her by telling her to stop her marriage with her husband and then together with the two older sisters, Nago cut her leg and threw chilli powder on her face and beat her badly.	Charter
An officer of Madampe police told Lankadeepa that all the bushes offered by the devotees to these churches were brought to the church of St. Sebastian in Madampe and collected with the offerings offered to the church of Saint Sebastian and checked by an employee.	offerings
"“D.P. Education IT Another program of the ""campus"" project was held yesterday at the Buttala Yudaganawa Rajamaha Viharaya."	development
Feeling lonely because of her sleeplessness, the two little daughters took a comb and scissors from the house and put a small five-point salon on the bed to cut off her long hair.	Charter
The Police Special Task Force said that it is suspected that the suspects may have obtained these pairs of tusks by killing the elephants that have been hanging around the Mankulam reserve areas for a long time.	pairs
Manikkavata, written by literary scholar Mahinda Prasad Masimbula, mentions the tragedy of the destruction of the golden Arunella field, which was lovingly preserved by the Hitihami village farmers, and turned into a gem mine by a heartless second generation.	Russia
We emphasize that it ends with victory.	corner
I would also like to emphasize that we have continuously objected to the fact that matters which are completely contrary to our positions have been included in the draft interim reports and falsely referred to as agreed matters.	Incorrect
After the rafting ritual, she was a bit nervous and even though her friends asked about it, she said nothing, but when she went on the honeymoon with the groom, she said that the ring on her finger was in pain because it was tight.	The ritual
"But it should be remembered that there were ""valavs"" in Heladiva before the British set foot in them. In the elite house known as the kivalav, only Kshatriyas, Brahmins and the highest-ranking aristocrats of the farming caste lived."	Heladiva
No matter how many streams there were, these people never caught fish there. If someone did that out of indifference, he would fall into the lower caste of the farmer. When we go to my mother's village, Bathigama, we also work in the fields. Going on a cow. All are chasing. If they catch fish like that, they will get a new name in Hirikati. They are called 'Marakkalai'.	All of them
It is believed that the events of Maitreya Bodhisattva Vahans receiving the final comment, the first missionary group, the Rahats, set out to propagate the Dharma, the Lord Buddha's visit to Uruel Danava to subdue the three evils, and the parinirvana of the Agasav Saryyuth prelates took place on the fifteenth day of Ilpura. Mentioned in history.	The knowledge
Because some people entrust matters to many deities such as Pattini Maeni, Kali Maeni, Ghana Devi, Gambhara Devi, Kataragama Devi, Vishnu Devi for Apala, Vibhishana Devi etc.	mother
My experience is that the most poverty is in the north and east of our country.	Poverty
"Uva Paranagama Organizer Uva Provincial Minister of Agriculture, Animal Production and Highways Mr. Upali Samaraweera: ""We are proud that the Prime Minister has visited the most difficult village at the edge of Uva Paranagama Constituency."	corner
The work of installing a golden fence on the ancient stone wall built around the bodhi of Hakmana Pallawela Keerthi Sri Tejovanarama Raja Maha Vihara is currently being completed.	Style
After cleaning the water from Higul Oya, the Lord of the temple blessed the elephant and tied it with strings and took it to Dalada Maliga.	the elephant
Then both of them hugged their stomachs and laughed as if to soothe the tiredness of the journey.	tiredness
Women manage the economy of the household thriftfully and have become the life and soul of this country.	in the house
Colombo 30278570 A few rains may occur.	a little
The police also found 4 gold pendants, 3 pairs of earrings, 3 gold necklaces and nearly 100 grams of gold belongings belonging to the suspects.	pairs
For example, when a man or a woman sees the bodies of these two, they feel a desire to be beautiful, good, fatherly, and cute, because the truth of the visible body is hidden.	It's the father
We are going to search for the places where we are suffering in the world. Where will we find peace in the shadow of the Buddha? These songs are named after Siddhartha Thero With began to spread among the crowd of fans.	Informed
Mr. Sajith Premadasa, who gave further comments at the public meeting organized by Mr. Abeynayake, said that he will provide this lunch as soon as he is appointed as the seventh executive president of this country and will continue to provide two sets of uniforms and two pairs of shoes to every school student. said.	pairs
The officials of the Research Division of the Department of Archeology found 4 gold caskets and a paligu casket in the stone manjusa found during the excavation of Wahalkada on the right side of the historical Dighavapi Dagabe.	When digging
The priceless sacrifice of your war hero has helped the entire nation to get a new life.	The sacrifice
We celebrate this day as National War Heroes Day in memory of those great disabled war heroes who sacrificed their lives to defeat the barbaric acts of terrorists.	Great
The upcoming Vesak festival is the best opportunity to clear the mind.	Domnasa
Accordingly, he went there on time even though the weather was very sunny in that area these days, his eyes were blue due to the burning sun.	The sunshine
After the bride went to sleep at night, this young woman secretly woke up and stole the bride's gold necklace and pendant from a cupboard and ran away from this house in the early morning.	in the morning
The minister, who saw about 400 people who had come to receive the services, were in the hot sun and became very angry and blamed the concerned officials for not providing facilities to those who came, saying that the festival assembly that was to be held was not necessary.	Rashmi
To facilitate transportation of tea leaves for factories, local councils, provincial councils road systems and bridges should be repaired urgently.	quickly
It is a place where the sunlight falls perfectly on the pool from the rising sun until the setting sun that covers the surrounding environment apart from the spectacular vegetation.	Vegetation
(St. Pradeep Kumara Kularatne) A supplication was made today (27th) at the historic Ganegoda Temple in Pannipitiya, Depanama, with the aim of giving wisdom to the members of parliament and to give wisdom to the president to give the prime ministership to the leader who has the majority according to public opinion.	Wisdom
Instead of deceiving the people, serving the people does not require the privileges of ministerial grants and if there is a right vision it can be done and everyone should come together to create a silver lining in the darkness of bankruptcy.	the darkness
The good acting skills of the little child named Ellie have also supported the above representation.	help
The fact that the Mahavamsa, the greatest historical document of our country, consisting of one hundred and twenty-nine chapters including the origin and development of the Sinhalese nation, has become a world heritage is a reason for the pride of the Sri Lankan Sinhalese people who are descended from the great nobles of Kali.	Great
AD The Tsunami disaster that struck on December 26, 2004 is the worst natural disaster on record in Sri Lanka.	Disaster
That is why four UNP members led by Prime Minister Ranil Wickremesinghe went to meet President Sirisena in an attempt to repair the damage on Tuesday evening when the cabinet meeting was held.	In the evening
It is further reported that when she wakes up after a while and is ashamed to see what has happened to her husband, she has left the marriage aside and is currently unable to come out of the house.	Charter
One of the longest reptiles in the world, the pythons crush their prey before swallowing it.	victims
Mr. Withanage said that they have been trying to build this power plant for more than ten years and it appears that they are doing it regardless of the objections coming against it. Mr. Withanage said that 15 endemic fish species and 18 endemic fish species are also living in the vicinity of this waterfall which is fed by the Sinharaja forest.	residence
In giving technology and human freedom to an advanced society, we see how many advanced people enjoy their knowledge, wisdom and wisdom in good ways and how many people use them in bad ways.	with wisdom
In the year 1949, after the present school was brought to the site, it was named Kasagahawatta Government College and then it was called Gampaha Bandaranaike College.	College
The distance is marked wherever there is distance.	remote
We won the first round of Corona with that powerful, powerful, and inspiring performance.	great
And not only then, but even in today's society, the Lord Buddha preached about how the society that respects a woman does not deteriorate by confirming the safety and respectability of women, the greatness of motherhood, etc.	said
"""The tourism officer heard that he will deduct 1500 rupees from his salary for sleeping"" and left happily."	Happy
Some of the allegedly stolen goods were found by the officers at the Angunacolapelassa police station and the police officers found a stock of goods including ten television sets, a laptop, two smart mobile phones, a small mobile phone, clothes, and several remote controls of the television sets.	remote
(Lalith Navaratne) According to the police, this situation has arisen due to the windy conditions caused by the heavy rains, which obstructed the traffic for about an hour today (08) after a russa kohomba tree fell across the road in Mundalama Navadankulam area of ​​Halawatha Puttalam road.	Russia
Consider the past rulers as great heroes.	Narapati
Western and North-Western provinces and Galle and Matara district may get some rain.	a little
The bus which was running from Gampaha towards Waturugama collided head-on with the lorry that came in front of it and rammed into the nearby house and a van that came behind also got into an accident.	a car
"Mihindu Maharahta, the son of Emperor Dharmasoka of India, who brought the precious gift of Buddhism to our country, addressed King Devanampiyatissa and said, ""Your Majesty, you are the absolute owner of the mountains, forests, rivers and streams, animals and plants of our land, but only the temporary guardian."	Vegetation
Police and relief workers say that at least eight people have died and twelve fishermen have gone missing due to the storm in the southern province.	from shift
We have declared this year 2017 as the year of freedom from poverty, we named it that way because nearly thirty percent of the population of our country is suffering from poverty.	the year
10,000 rupees to one hotel manager who was found guilty of storing chicken excrement to prepare egg food and storing cooked food exposed to flies, other charges of keeping open dustbins without lids and storing expired chocolates. The manager was also fined Rs.10,000.	Baduna
Now some people paint tricycles in different colors.	Colours
The agreement was made between the Sri Lankan Abance Company and the famous Singaporean hotel company, Silver Needle Hospitality Company, to build this shopping complex facing Yagabere Lake.	known
The attention of many people was drawn to this issue after reports were published in the media that the front right leg of the Kalana elephant, which had been tied in one place for about three years, was cut by the iron chain and was suffering from severe pain.	the elephant
Luckily for the memory of Robert Knox, who wrote the work called Heladiva, the Mootoor Pradeshiya Sabha managed to preserve and maintain a branch of this tree at that place.	Heladiva
The Blessed One opened the way to freedom from suffering by improving the virtues of the life that is oppressed by suffering.	The path
Colombo30278570Slight rainGalle29268580Slight rainJaffna32268570Mainly no rainManuwara29219575Slight rainNuwaraEliya19139585Slight rain likelyRathnapura31249575Slight rainTrikunamalay3626 7540Rain or rain after around 2.00 pm Heavy rain Mannar 30269075 Mainly rainless	a little
"Sri Lanka Freedom Party talked about socialism but did not allow one man from the proletariat to come forward""."	Proof
There I wanted to confirm that there is a social mission behind my work rather than any change.	a mission
(Srinath Prasanna Jayasuriya) Madampe Police said that during the inspection of the gifts offered by the devotees to eight churches during the Christmas Masses, two T-56 rounds were found in a small black box at Madampe St. Sebastian's Church.	offerings
The casket was placed on the elephant's back as an auspicious sign.	the elephant
The historic Bhuvanekaba Raj Sabha Mandap in the center of Kurunegala city has been bulldozed.	Historical
Businessmen of Mannar say that they pray for the peace of mind of the brothers who lost their lives in the bombings, and they are mourning for it, and they have closed their shops to express their grief.	sadness
Accordingly, we earnestly request the President as well as the Prime Minister and the government to act without delay to enforce the national procurement process.	immediately
The global economic theory of Trans-National Companies further dilute weak nation-states, absorb their skilled workers and professionals into the developed countries at the core of the global capitalist system, and turn the peripheral countries into nothing more than common-profit-labor-camps. According to the paper, it is an expected result.	capitalist
The prize money awarded to the champion of this cycle ride is two lakh rupees.	the champion
The Magistrate made this order alleging that the toilet waste removed from the toilets in the grounds of the Somavathiya Raja Maha Viharastha is being illegally disposed of in the Polonnaruwa Zone of the Wildlife Department by gully bowsers in the area beyond the electric fence near the Somavathi Pagoda in the Somavathiya National Park in violation of the Wildlife Ordinance. After considering a case filed in the Polonnaruwa Magistrate's Court by the officers of the office.	outside
We are proud that the Prime Minister visited the most difficult village at the corner of Uva Paranagama Constituency.	corner
Several photographs are being shared on social media showing that a large flower bouquet made of flowers of plants protected by the Protection of Endangered Wildlife and Wild Fauna Flora Act of Siripa Reserve was offered to Sri Pada.	Vegetation
It was also stated that the entire world can see that our country is naked except us.	Naked
We give the money for the economic revival of their household through a special work arrangement initiated by the housewife.	in the house
It is stated in a complaint made by his wife Dishna Kumari to the Polonnaruwa Police that the deceased Rangana Sanjeeva Kumara had gone to bathe with a friend on his motorcycle and did not return home.	a friend
Suddenly the light shines, and the Afghan is helpless	aura
The chairman said that this activity was started with the objectives of instilling the interest of reading in long-distance passengers, relieving travel fatigue, and feeding passengers with knowledge.	tiredness
Above the head of the Sel idol built with the Dharma Chakra Mudra, a circular pantheon with spectacular carvings can also be seen.	Spectacular
Now the report of that committee has been revealed and there has been a big discussion about it in the society.	large
Mr. Tushan says that when a corona patient is quarantined with these two new designs, the disease will not spread to anyone else who is near him or in that house.	in the house
He said this while attending a press conference held yesterday at the head office of Pelawatta JVP.	Main
Although no serious damage was reported to the students due to the fire, the hospital sources say that some people with minor injuries and some people who could not bear the heat and suffered from some allergic reactions have been admitted to the Kuliapitiya Base Hospital.	Rashmi
(Dayaratne Ambogama) The Eppawala Police say that during a search operation conducted by the Eppawala Police this morning (5), four persons traveling in a car with a fake pistol and 12 persons were arrested on other charges.	in the morning
Today we are enjoying the results of the great dedication and noble sacrifices of the heroic generals who led those warriors.	Narapati
Everyone was silent when the President said that a lot of things are happening and that all of them cannot be revealed now.	silent
Jaffna32259065Slight showersManuwara31219550Showers or thundershowers in the afternoon or evening.	a little
2600 years ago, Lord Buddha preached that Buddhism will be shining in the island of Ceylon at the time of the end of the world.	the island
On September 18, 1918, under the initiative of Mr. Charles Samarasuriya, the head of the college, this school started under the name of Henarathgoda Sivali Buddhist School and later became known as Henarathgoda Government Senior Secondary English School.	College
(Rohana Samaraweera) The Godakawela police say that they stopped a lorry that was driving despite the orders of the police officers early today (29) and during the inspection, there were 8 cows that were being transported illegally and the lorry was arrested along with two suspects.	in the morning
They are pointing out that instead of the good things that happened to the country in 19th, instead of the 19th amendment, the strength that gave freedom to democracy has been put aside.	to calamities
This Diyakawa joint military exercise operation, which will be conducted till the 24th of this month by using land, air and water, is scheduled to end at Trincomalee's Kutchiveliverala belt.	Water
The Myanmar Times newspaper had reported quoting an announcement from the Ministry of Foreign Affairs that Myanmar has officially informed Sri Lanka to stop the cruel treatment of the elephant named Mian Kumara, which was donated by its government to a Buddhist temple in Sri Lanka 6 years ago.	the elephant
Using the new machine, only four acres of paddy fields can be planted in a day, and this is a good solution to the current shortage of trained workers, says the Department of Agriculture.	nice
For the development of the country, for the future of the country, I see strengthening the anti-corruption opinion and implementing that opinion as the self-defense of the nation's progress.	self defence
On behalf of the trade unions and the party, I again apologize to the four times as many people standing outside the hall.	profession
This man was at home with his second wife early in the morning when the wife of his first marriage broke the windows of the house and entered the house and stabbed the man.	wife
Let's plan thirty to forty years into the 21st century and innovate to get there.	in the year
A lot of people's trust has been built around this party.	large
The current editor-in-chief, Emeritus Professor Rohini Paranavithana, and the editorial staff are engaged in the work of compiling the dictionary and dedicate themselves to the nurturing and preservation of the Sinhala language with the desire to make the Sinhala dictionary, which will complete its centenary in another five years, not just an encyclopedia but also a glorious national mission.	a mission
But performing the surgery at the optimal time is very helpful to cure the disease.	Rukulakwe
This public representative performed his ritual every year.	The ritual
Police say that this woman has also stolen gold worth 9,000 rupees and cash of 500 rupees from the handbag belonging to the first wife of the injured person.	wife
When going to the operating theater for a surgery, it is very helpful for the doctor to leave all his money, jewelry, etc.	a help
The ministry said that this resting place is to be built in such a way that it does not harm the wild animals and flora.	Vegetation
The other unfortunate fact faced by the soldiers of the armed forces and the police is that they have to wait and let the honor and dignity of their profession be undermined according to the needs of the politicians and their relatives who are dealing with political power illegally.	in the profession
As the Acting High Commissioner mentioned, I am seeing you this evening as a delegation of almost four hundred thousand Sri Lankans.	In the evening
The launch of the book ÒEchoes of the People's Struggle' written by Dr. Murutthettuwe Ananda Thero, Chief Sanghanayaka of Narahenpita, Western Province and Chancellor of the University of Colombo will be held tomorrow (15) at 3.30 pm in the main hall of Narahenpita Sri Abhayarama under the chairmanship of speaker Mr. Mahinda Yapa Abeywardena.	Main
The government is silent because they have no solution.	silent
You may not know that there were local medical experts in Heladi who removed the bones and transplanted the bones of various animals in cases where the bones of the body were broken and crushed.	Heladiva
